{
  "schemaVersion": 1,
  "meta": {
    "channel": "gsc",
    "lastSyncedAt": "2026-08-10T09:03:11+05:30",
    "earliestRecordDate": "2026-05-01",
    "latestRecordDate": "2026-08-07",
    "coworkRunId": "run_2026-08-10T0900",
    "syncSource": "Search Console API",
    "rowCounts": {
      "daily": 92
    }
  },
  "daily": [
    {
      "date": "2026-06-01",
      "clicks": 16,
      "impressions": 1825,
      "sumPosition": 54927,
      "rows": 60
    },
    {
      "date": "2026-06-02",
      "clicks": 16,
      "impressions": 1825,
      "sumPosition": 54927,
      "rows": 61
    },
    {
      "date": "2026-06-03",
      "clicks": 16,
      "impressions": 1825,
      "sumPosition": 54927,
      "rows": 62
    },
    {
      "date": "2026-06-04",
      "clicks": 16,
      "impressions": 1825,
      "sumPosition": 54927,
      "rows": 63
    },
    {
      "date": "2026-06-05",
      "clicks": 16,
      "impressions": 1825,
      "sumPosition": 54927,
      "rows": 64
    },
    {
      "date": "2026-06-06",
      "clicks": 16,
      "impressions": 1825,
      "sumPosition": 54927,
      "rows": 65
    },
    {
      "date": "2026-06-07",
      "clicks": 16,
      "impressions": 1825,
      "sumPosition": 54927,
      "rows": 66
    },
    {
      "date": "2026-06-08",
      "clicks": 16,
      "impressions": 1825,
      "sumPosition": 54927,
      "rows": 67
    },
    {
      "date": "2026-06-09",
      "clicks": 16,
      "impressions": 1825,
      "sumPosition": 54927,
      "rows": 68
    },
    {
      "date": "2026-06-10",
      "clicks": 16,
      "impressions": 1825,
      "sumPosition": 54927,
      "rows": 69
    },
    {
      "date": "2026-06-11",
      "clicks": 16,
      "impressions": 1825,
      "sumPosition": 54927,
      "rows": 70
    },
    {
      "date": "2026-06-12",
      "clicks": 16,
      "impressions": 1825,
      "sumPosition": 54927,
      "rows": 71
    },
    {
      "date": "2026-06-13",
      "clicks": 16,
      "impressions": 1825,
      "sumPosition": 54927,
      "rows": 72
    },
    {
      "date": "2026-06-14",
      "clicks": 16,
      "impressions": 1825,
      "sumPosition": 54927,
      "rows": 73
    },
    {
      "date": "2026-06-15",
      "clicks": 16,
      "impressions": 1825,
      "sumPosition": 54926,
      "rows": 74
    },
    {
      "date": "2026-06-16",
      "clicks": 16,
      "impressions": 1825,
      "sumPosition": 54926,
      "rows": 75
    },
    {
      "date": "2026-06-17",
      "clicks": 16,
      "impressions": 1825,
      "sumPosition": 54926,
      "rows": 76
    },
    {
      "date": "2026-06-18",
      "clicks": 16,
      "impressions": 1825,
      "sumPosition": 54926,
      "rows": 77
    },
    {
      "date": "2026-06-19",
      "clicks": 16,
      "impressions": 1825,
      "sumPosition": 54926,
      "rows": 78
    },
    {
      "date": "2026-06-20",
      "clicks": 15,
      "impressions": 1825,
      "sumPosition": 54926,
      "rows": 79
    },
    {
      "date": "2026-06-21",
      "clicks": 15,
      "impressions": 1825,
      "sumPosition": 54926,
      "rows": 60
    },
    {
      "date": "2026-06-22",
      "clicks": 15,
      "impressions": 1825,
      "sumPosition": 54926,
      "rows": 61
    },
    {
      "date": "2026-06-23",
      "clicks": 15,
      "impressions": 1825,
      "sumPosition": 54926,
      "rows": 62
    },
    {
      "date": "2026-06-24",
      "clicks": 15,
      "impressions": 1825,
      "sumPosition": 54926,
      "rows": 63
    },
    {
      "date": "2026-06-25",
      "clicks": 15,
      "impressions": 1824,
      "sumPosition": 54926,
      "rows": 64
    },
    {
      "date": "2026-06-26",
      "clicks": 15,
      "impressions": 1824,
      "sumPosition": 54926,
      "rows": 65
    },
    {
      "date": "2026-06-27",
      "clicks": 15,
      "impressions": 1824,
      "sumPosition": 54926,
      "rows": 66
    },
    {
      "date": "2026-06-28",
      "clicks": 15,
      "impressions": 1824,
      "sumPosition": 54926,
      "rows": 67
    },
    {
      "date": "2026-06-29",
      "clicks": 15,
      "impressions": 1824,
      "sumPosition": 54926,
      "rows": 68
    },
    {
      "date": "2026-06-30",
      "clicks": 15,
      "impressions": 1824,
      "sumPosition": 54926,
      "rows": 69
    },
    {
      "date": "2026-05-01",
      "clicks": 12,
      "impressions": 1500,
      "sumPosition": 48000,
      "rows": 55
    },
    {
      "date": "2026-05-02",
      "clicks": 13,
      "impressions": 1550,
      "sumPosition": 49600,
      "rows": 55
    },
    {
      "date": "2026-05-03",
      "clicks": 14,
      "impressions": 1600,
      "sumPosition": 51200,
      "rows": 55
    },
    {
      "date": "2026-05-04",
      "clicks": 15,
      "impressions": 1650,
      "sumPosition": 52800,
      "rows": 55
    },
    {
      "date": "2026-05-05",
      "clicks": 16,
      "impressions": 1700,
      "sumPosition": 54400,
      "rows": 55
    },
    {
      "date": "2026-05-06",
      "clicks": 12,
      "impressions": 1750,
      "sumPosition": 56000,
      "rows": 55
    },
    {
      "date": "2026-05-07",
      "clicks": 13,
      "impressions": 1800,
      "sumPosition": 57600,
      "rows": 55
    },
    {
      "date": "2026-05-08",
      "clicks": 14,
      "impressions": 1850,
      "sumPosition": 59200,
      "rows": 55
    },
    {
      "date": "2026-05-09",
      "clicks": 15,
      "impressions": 1900,
      "sumPosition": 60800,
      "rows": 55
    },
    {
      "date": "2026-05-10",
      "clicks": 16,
      "impressions": 1950,
      "sumPosition": 62400,
      "rows": 55
    },
    {
      "date": "2026-05-11",
      "clicks": 12,
      "impressions": 1500,
      "sumPosition": 48000,
      "rows": 55
    },
    {
      "date": "2026-05-12",
      "clicks": 13,
      "impressions": 1550,
      "sumPosition": 49600,
      "rows": 55
    },
    {
      "date": "2026-05-13",
      "clicks": 14,
      "impressions": 1600,
      "sumPosition": 51200,
      "rows": 55
    },
    {
      "date": "2026-05-14",
      "clicks": 15,
      "impressions": 1650,
      "sumPosition": 52800,
      "rows": 55
    },
    {
      "date": "2026-05-15",
      "clicks": 16,
      "impressions": 1700,
      "sumPosition": 54400,
      "rows": 55
    },
    {
      "date": "2026-05-16",
      "clicks": 12,
      "impressions": 1750,
      "sumPosition": 56000,
      "rows": 55
    },
    {
      "date": "2026-05-17",
      "clicks": 13,
      "impressions": 1800,
      "sumPosition": 57600,
      "rows": 55
    },
    {
      "date": "2026-05-18",
      "clicks": 14,
      "impressions": 1850,
      "sumPosition": 59200,
      "rows": 55
    },
    {
      "date": "2026-05-19",
      "clicks": 15,
      "impressions": 1900,
      "sumPosition": 60800,
      "rows": 55
    },
    {
      "date": "2026-05-20",
      "clicks": 16,
      "impressions": 1950,
      "sumPosition": 62400,
      "rows": 55
    },
    {
      "date": "2026-05-21",
      "clicks": 12,
      "impressions": 1500,
      "sumPosition": 48000,
      "rows": 55
    },
    {
      "date": "2026-05-22",
      "clicks": 13,
      "impressions": 1550,
      "sumPosition": 49600,
      "rows": 55
    },
    {
      "date": "2026-05-23",
      "clicks": 14,
      "impressions": 1600,
      "sumPosition": 51200,
      "rows": 55
    },
    {
      "date": "2026-05-24",
      "clicks": 15,
      "impressions": 1650,
      "sumPosition": 52800,
      "rows": 55
    },
    {
      "date": "2026-05-25",
      "clicks": 16,
      "impressions": 1700,
      "sumPosition": 54400,
      "rows": 55
    },
    {
      "date": "2026-05-26",
      "clicks": 12,
      "impressions": 1750,
      "sumPosition": 56000,
      "rows": 55
    },
    {
      "date": "2026-05-27",
      "clicks": 13,
      "impressions": 1800,
      "sumPosition": 57600,
      "rows": 55
    },
    {
      "date": "2026-05-28",
      "clicks": 14,
      "impressions": 1850,
      "sumPosition": 59200,
      "rows": 55
    },
    {
      "date": "2026-05-29",
      "clicks": 15,
      "impressions": 1900,
      "sumPosition": 60800,
      "rows": 55
    },
    {
      "date": "2026-05-30",
      "clicks": 16,
      "impressions": 1950,
      "sumPosition": 62400,
      "rows": 55
    },
    {
      "date": "2026-05-31",
      "clicks": 12,
      "impressions": 1500,
      "sumPosition": 48000,
      "rows": 55
    },
    {
      "date": "2026-07-01",
      "clicks": 12,
      "impressions": 1500,
      "sumPosition": 48000,
      "rows": 55
    },
    {
      "date": "2026-07-02",
      "clicks": 13,
      "impressions": 1550,
      "sumPosition": 49600,
      "rows": 55
    },
    {
      "date": "2026-07-03",
      "clicks": 14,
      "impressions": 1600,
      "sumPosition": 51200,
      "rows": 55
    },
    {
      "date": "2026-07-04",
      "clicks": 15,
      "impressions": 1650,
      "sumPosition": 52800,
      "rows": 55
    },
    {
      "date": "2026-07-05",
      "clicks": 16,
      "impressions": 1700,
      "sumPosition": 54400,
      "rows": 55
    },
    {
      "date": "2026-07-06",
      "clicks": 12,
      "impressions": 1750,
      "sumPosition": 56000,
      "rows": 55
    },
    {
      "date": "2026-07-07",
      "clicks": 13,
      "impressions": 1800,
      "sumPosition": 57600,
      "rows": 55
    },
    {
      "date": "2026-07-08",
      "clicks": 14,
      "impressions": 1850,
      "sumPosition": 59200,
      "rows": 55
    },
    {
      "date": "2026-07-09",
      "clicks": 15,
      "impressions": 1900,
      "sumPosition": 60800,
      "rows": 55
    },
    {
      "date": "2026-07-10",
      "clicks": 16,
      "impressions": 1950,
      "sumPosition": 62400,
      "rows": 55
    },
    {
      "date": "2026-07-11",
      "clicks": 12,
      "impressions": 1500,
      "sumPosition": 48000,
      "rows": 55
    },
    {
      "date": "2026-07-12",
      "clicks": 13,
      "impressions": 1550,